{
  "$schema": "./applications.schema.json",
  "applications": [
    {
      "declaration_count": 4,
      "declarations": [
        {
          "application_namespace": "argocd",
          "destination": {
            "name": "",
            "namespace": "ai-agent-coordinator",
            "server": "https://kubernetes.default.svc"
          },
          "document_index": 0,
          "manifest_path": "remote/argocd/apps/ai-agent-coordinator.application.yaml",
          "project": "ai-agent-coordinator",
          "sources": [
            {
              "chart": "",
              "path": "deploy/overlays/cross-org-linear-pilot",
              "repo_url": "https://github.com/ORESoftware/ai-agent-coordinator.rs.git",
              "target_revision": "d25e04e50be4a9fad039cfcfa6c321e9c99a1e02"
            }
          ],
          "sync_policy": {
            "automated": true,
            "create_namespace": false,
            "prune": true,
            "self_heal": true,
            "sync_options": [
              "PruneLast=true",
              "ServerSideApply=true"
            ]
          }
        },
        {
          "application_namespace": "argocd",
          "destination": {
            "name": "",
            "namespace": "ai-agent-coordinator",
            "server": "https://kubernetes.default.svc"
          },
          "document_index": 1,
          "manifest_path": "remote/argocd/clusters/aws/ai-agent-coordinator.applications.yaml",
          "project": "ai-agent-coordinator",
          "sources": [
            {
              "chart": "",
              "path": "deploy/overlays/cross-org-linear-pilot",
              "repo_url": "https://github.com/ORESoftware/ai-agent-coordinator.rs.git",
              "target_revision": "d25e04e50be4a9fad039cfcfa6c321e9c99a1e02"
            }
          ],
          "sync_policy": {
            "automated": true,
            "create_namespace": false,
            "prune": true,
            "self_heal": true,
            "sync_options": [
              "PruneLast=true",
              "ServerSideApply=true"
            ]
          }
        },
        {
          "application_namespace": "argocd",
          "destination": {
            "name": "",
            "namespace": "ai-agent-coordinator",
            "server": "https://kubernetes.default.svc"
          },
          "document_index": 1,
          "manifest_path": "remote/argocd/clusters/gcp/ai-agent-coordinator.applications.yaml",
          "project": "ai-agent-coordinator",
          "sources": [
            {
              "chart": "",
              "path": "deploy/overlays/cross-org-linear-pilot",
              "repo_url": "https://github.com/ORESoftware/ai-agent-coordinator.rs.git",
              "target_revision": "d25e04e50be4a9fad039cfcfa6c321e9c99a1e02"
            }
          ],
          "sync_policy": {
            "automated": true,
            "create_namespace": false,
            "prune": true,
            "self_heal": true,
            "sync_options": [
              "PruneLast=true",
              "ServerSideApply=true"
            ]
          }
        },
        {
          "application_namespace": "argocd",
          "destination": {
            "name": "",
            "namespace": "ai-agent-coordinator",
            "server": "https://kubernetes.default.svc"
          },
          "document_index": 1,
          "manifest_path": "remote/argocd/clusters/hetzner/ai-agent-coordinator.applications.yaml",
          "project": "ai-agent-coordinator",
          "sources": [
            {
              "chart": "",
              "path": "deploy/overlays/cross-org-linear-pilot",
              "repo_url": "https://github.com/ORESoftware/ai-agent-coordinator.rs.git",
              "target_revision": "d25e04e50be4a9fad039cfcfa6c321e9c99a1e02"
            }
          ],
          "sync_policy": {
            "automated": true,
            "create_namespace": false,
            "prune": true,
            "self_heal": true,
            "sync_options": [
              "PruneLast=true",
              "ServerSideApply=true"
            ]
          }
        }
      ],
      "duplicate_name": true,
      "name": "ai-agent-coordinator"
    },
    {
      "declaration_count": 1,
      "declarations": [
        {
          "application_namespace": "argocd",
          "destination": {
            "name": "",
            "namespace": "ai-agent-coordinator",
            "server": "https://kubernetes.default.svc"
          },
          "document_index": 0,
          "manifest_path": "remote/argocd/clusters/aws/ai-agent-coordinator-artifact-recovery.application.yaml",
          "project": "ai-agent-coordinator",
          "sources": [
            {
              "chart": "",
              "path": "deploy/continuous-artifact-recovery/k8s",
              "repo_url": "https://github.com/ORESoftware/ai-agent-coordinator.rs.git",
              "target_revision": "c5a08d1afd26d2982e53fc2066bde9cf64ee5d19"
            }
          ],
          "sync_policy": {
            "automated": false,
            "create_namespace": false,
            "prune": false,
            "self_heal": false,
            "sync_options": [
              "PruneLast=true",
              "ServerSideApply=true"
            ]
          }
        }
      ],
      "duplicate_name": false,
      "name": "ai-agent-coordinator-artifact-recovery"
    },
    {
      "declaration_count": 4,
      "declarations": [
        {
          "application_namespace": "argocd",
          "destination": {
            "name": "",
            "namespace": "argocd",
            "server": "https://kubernetes.default.svc"
          },
          "document_index": 0,
          "manifest_path": "remote/argocd/apps/ai-agent-coordinator-platform.application.yaml",
          "project": "default",
          "sources": [
            {
              "chart": "",
              "path": "remote/argocd/projects/ai-agent-coordinator",
              "repo_url": "https://github.com/ORESoftware/k8s-cluster.git",
              "target_revision": "dev"
            }
          ],
          "sync_policy": {
            "automated": true,
            "create_namespace": false,
            "prune": true,
            "self_heal": true,
            "sync_options": [
              "PruneLast=true",
              "ServerSideApply=true"
            ]
          }
        },
        {
          "application_namespace": "argocd",
          "destination": {
            "name": "",
            "namespace": "argocd",
            "server": "https://kubernetes.default.svc"
          },
          "document_index": 0,
          "manifest_path": "remote/argocd/clusters/aws/ai-agent-coordinator.applications.yaml",
          "project": "default",
          "sources": [
            {
              "chart": "",
              "path": "remote/argocd/projects/ai-agent-coordinator",
              "repo_url": "https://github.com/ORESoftware/k8s-cluster.git",
              "target_revision": "dev"
            }
          ],
          "sync_policy": {
            "automated": true,
            "create_namespace": false,
            "prune": true,
            "self_heal": true,
            "sync_options": [
              "PruneLast=true",
              "ServerSideApply=true"
            ]
          }
        },
        {
          "application_namespace": "argocd",
          "destination": {
            "name": "",
            "namespace": "argocd",
            "server": "https://kubernetes.default.svc"
          },
          "document_index": 0,
          "manifest_path": "remote/argocd/clusters/gcp/ai-agent-coordinator.applications.yaml",
          "project": "default",
          "sources": [
            {
              "chart": "",
              "path": "remote/argocd/projects/ai-agent-coordinator",
              "repo_url": "https://github.com/ORESoftware/k8s-cluster.git",
              "target_revision": "dev"
            }
          ],
          "sync_policy": {
            "automated": true,
            "create_namespace": false,
            "prune": true,
            "self_heal": true,
            "sync_options": [
              "PruneLast=true",
              "ServerSideApply=true"
            ]
          }
        },
        {
          "application_namespace": "argocd",
          "destination": {
            "name": "",
            "namespace": "argocd",
            "server": "https://kubernetes.default.svc"
          },
          "document_index": 0,
          "manifest_path": "remote/argocd/clusters/hetzner/ai-agent-coordinator.applications.yaml",
          "project": "default",
          "sources": [
            {
              "chart": "",
              "path": "remote/argocd/projects/ai-agent-coordinator",
              "repo_url": "https://github.com/ORESoftware/k8s-cluster.git",
              "target_revision": "dev"
            }
          ],
          "sync_policy": {
            "automated": true,
            "create_namespace": false,
            "prune": true,
            "self_heal": true,
            "sync_options": [
              "PruneLast=true",
              "ServerSideApply=true"
            ]
          }
        }
      ],
      "duplicate_name": true,
      "name": "ai-agent-coordinator-platform"
    },
    {
      "declaration_count": 3,
      "declarations": [
        {
          "application_namespace": "argocd",
          "destination": {
            "name": "",
            "namespace": "default",
            "server": "https://kubernetes.default.svc"
          },
          "document_index": 0,
          "manifest_path": "remote/argocd/apps/benefactor-backend-rs.application.yaml",
          "project": "default",
          "sources": [
            {
              "chart": "",
              "path": "remote/argocd/benefactor-backend-rs",
              "repo_url": "https://github.com/ORESoftware/k8s-cluster.git",
              "target_revision": "dev"
            }
          ],